Orden,Proceso,Detalles
1,Preparacion de la pasta de tomate ,Especificar si la pasta de tomate  llega procesada a la fabrica o es elaborada en la misma.
2,Mezclado ,"La pasta de tomate es mezclada con los demas ingredientes en tanques, hasta tener una consistencia homogenea."
3,Pasteurizacion,La mezcla anterior se somete a pasteurizacion 96 C por 4-6 min.
4,Concentracion,"Se elimina el oxigeno de la mezcla antes de llevarla al envasado 
"
5,Envasado,"Se embotella a una temperatura de 82-88 C. Posteriormente se ponen las etiquetas segun el embalaje elegido y salen de fabrica 
"